{
  "index_version": "2.0.1",
  "created_at": "2026-05-07T07:00:00Z",
  "updated_at": "2026-05-07T10:00:00Z",
  "total_entries": 3,
  "entries": [
    {
      "citation_id": "EV-0100",
      "evidence_class": "observed",
      "claim": "Schema validation script returns exit code 0 on valid council-config fixture.",
      "confidence": "high",
      "verification": "python scripts/validate-council-config.py tests/schemas/council-config/valid/example-01.json",
      "source_file": "scripts/validate-council-config.py",
      "source_line_range": "1-45",
      "sprint_context": 1,
      "gathered_at": "2026-05-07T07:00:00Z",
      "gathered_by_agent": "sentinel"
    },
    {
      "citation_id": "EV-0101",
      "evidence_class": "speculative",
      "claim": "The new schema fields may cause backward-compatibility issues with existing records.",
      "confidence": "low",
      "sprint_context": 1,
      "gathered_at": "2026-05-07T08:00:00Z",
      "gathered_by_agent": "archaeologist"
    },
    {
      "citation_id": "EV-0102",
      "evidence_class": "inferred",
      "claim": "Sprint 1 schema coverage is complete based on fixture count and validator test results.",
      "confidence": "high",
      "referenced_by": ["DEC-0001"],
      "sprint_context": 1,
      "gathered_at": "2026-05-07T10:00:00Z",
      "gathered_by_agent": "orchestrator"
    }
  ]
}
